{
  "schemaVersion": 1,
  "upstreamCommit": "8d9b6da99ea7d4a8e7d906dd2532456dfe14e24f",
  "releaseEligible": false,
  "scopeComplete": false,
  "concreteCases": null,
  "frozenCohort": {
    "separate": true,
    "cases": 29,
    "mappingToUpstreamInventory": "UNVERIFIED",
    "creditTowardFullScope": 0
  },
  "domains": [
    {
      "id": "baseline:api",
      "sourceAssets": 2,
      "concreteCases": null,
      "expansion": "UNEXPANDED",
      "implementation": "UNIMPLEMENTED",
      "compiler": "NOT_RUN",
      "reference": "NOT_RUN",
      "acceptance": "NOT_RUN",
      "evidence": []
    },
    {
      "id": "baseline:astnav",
      "sourceAssets": 7,
      "concreteCases": null,
      "expansion": "UNEXPANDED",
      "implementation": "UNIMPLEMENTED",
      "compiler": "NOT_RUN",
      "reference": "NOT_RUN",
      "acceptance": "NOT_RUN",
      "evidence": []
    },
    {
      "id": "baseline:compiler",
      "sourceAssets": 24026,
      "concreteCases": null,
      "expansion": "UNEXPANDED",
      "implementation": "UNIMPLEMENTED",
      "compiler": "NOT_RUN",
      "reference": "NOT_RUN",
      "acceptance": "NOT_RUN",
      "evidence": []
    },
    {
      "id": "baseline:config",
      "sourceAssets": 237,
      "concreteCases": null,
      "expansion": "UNEXPANDED",
      "implementation": "UNIMPLEMENTED",
      "compiler": "NOT_RUN",
      "reference": "NOT_RUN",
      "acceptance": "NOT_RUN",
      "evidence": []
    },
    {
      "id": "baseline:conformance",
      "sourceAssets": 22326,
      "concreteCases": null,
      "expansion": "UNEXPANDED",
      "implementation": "UNIMPLEMENTED",
      "compiler": "NOT_RUN",
      "reference": "NOT_RUN",
      "acceptance": "NOT_RUN",
      "evidence": []
    },
    {
      "id": "baseline:fourslash",
      "sourceAssets": 1763,
      "concreteCases": null,
      "expansion": "UNEXPANDED",
      "implementation": "UNIMPLEMENTED",
      "compiler": "NOT_RUN",
      "reference": "NOT_RUN",
      "acceptance": "NOT_RUN",
      "evidence": []
    },
    {
      "id": "baseline:lsp",
      "sourceAssets": 3,
      "concreteCases": null,
      "expansion": "UNEXPANDED",
      "implementation": "UNIMPLEMENTED",
      "compiler": "NOT_RUN",
      "reference": "NOT_RUN",
      "acceptance": "NOT_RUN",
      "evidence": []
    },
    {
      "id": "baseline:project",
      "sourceAssets": 2,
      "concreteCases": null,
      "expansion": "UNEXPANDED",
      "implementation": "UNIMPLEMENTED",
      "compiler": "NOT_RUN",
      "reference": "NOT_RUN",
      "acceptance": "NOT_RUN",
      "evidence": []
    },
    {
      "id": "baseline:transpile",
      "sourceAssets": 41,
      "concreteCases": null,
      "expansion": "UNEXPANDED",
      "implementation": "UNIMPLEMENTED",
      "compiler": "NOT_RUN",
      "reference": "NOT_RUN",
      "acceptance": "NOT_RUN",
      "evidence": []
    },
    {
      "id": "baseline:tsbuild",
      "sourceAssets": 193,
      "concreteCases": null,
      "expansion": "UNEXPANDED",
      "implementation": "UNIMPLEMENTED",
      "compiler": "NOT_RUN",
      "reference": "NOT_RUN",
      "acceptance": "NOT_RUN",
      "evidence": []
    },
    {
      "id": "baseline:tsbuildWatch",
      "sourceAssets": 65,
      "concreteCases": null,
      "expansion": "UNEXPANDED",
      "implementation": "UNIMPLEMENTED",
      "compiler": "NOT_RUN",
      "reference": "NOT_RUN",
      "acceptance": "NOT_RUN",
      "evidence": []
    },
    {
      "id": "baseline:tsc",
      "sourceAssets": 251,
      "concreteCases": null,
      "expansion": "UNEXPANDED",
      "implementation": "UNIMPLEMENTED",
      "compiler": "NOT_RUN",
      "reference": "NOT_RUN",
      "acceptance": "NOT_RUN",
      "evidence": []
    },
    {
      "id": "baseline:tscWatch",
      "sourceAssets": 42,
      "concreteCases": null,
      "expansion": "UNEXPANDED",
      "implementation": "UNIMPLEMENTED",
      "compiler": "NOT_RUN",
      "reference": "NOT_RUN",
      "acceptance": "NOT_RUN",
      "evidence": []
    },
    {
      "id": "baseline:tsoptions",
      "sourceAssets": 70,
      "concreteCases": null,
      "expansion": "UNEXPANDED",
      "implementation": "UNIMPLEMENTED",
      "compiler": "NOT_RUN",
      "reference": "NOT_RUN",
      "acceptance": "NOT_RUN",
      "evidence": []
    },
    {
      "id": "fixture:compiler",
      "sourceAssets": 7035,
      "concreteCases": null,
      "expansion": "UNEXPANDED",
      "implementation": "UNIMPLEMENTED",
      "compiler": "NOT_RUN",
      "reference": "NOT_RUN",
      "acceptance": "NOT_RUN",
      "evidence": []
    },
    {
      "id": "fixture:conformance",
      "sourceAssets": 5948,
      "concreteCases": null,
      "expansion": "UNEXPANDED",
      "implementation": "UNIMPLEMENTED",
      "compiler": "NOT_RUN",
      "reference": "NOT_RUN",
      "acceptance": "NOT_RUN",
      "evidence": []
    },
    {
      "id": "fixture:transpile",
      "sourceAssets": 25,
      "concreteCases": null,
      "expansion": "UNEXPANDED",
      "implementation": "UNIMPLEMENTED",
      "compiler": "NOT_RUN",
      "reference": "NOT_RUN",
      "acceptance": "NOT_RUN",
      "evidence": []
    },
    {
      "id": "go:tools/cmd/import-localization",
      "sourceAssets": 1,
      "concreteCases": null,
      "expansion": "UNEXPANDED",
      "implementation": "UNIMPLEMENTED",
      "compiler": "NOT_RUN",
      "reference": "NOT_RUN",
      "acceptance": "NOT_RUN",
      "evidence": []
    },
    {
      "id": "go:tools/cmd/machotool",
      "sourceAssets": 1,
      "concreteCases": null,
      "expansion": "UNEXPANDED",
      "implementation": "UNIMPLEMENTED",
      "compiler": "NOT_RUN",
      "reference": "NOT_RUN",
      "acceptance": "NOT_RUN",
      "evidence": []
    },
    {
      "id": "go:tools/customlint",
      "sourceAssets": 1,
      "concreteCases": null,
      "expansion": "UNEXPANDED",
      "implementation": "UNIMPLEMENTED",
      "compiler": "NOT_RUN",
      "reference": "NOT_RUN",
      "acceptance": "NOT_RUN",
      "evidence": []
    },
    {
      "id": "go:tools/gen-preferences",
      "sourceAssets": 1,
      "concreteCases": null,
      "expansion": "UNEXPANDED",
      "implementation": "UNIMPLEMENTED",
      "compiler": "NOT_RUN",
      "reference": "NOT_RUN",
      "acceptance": "NOT_RUN",
      "evidence": []
    },
    {
      "id": "go:tools/gen-proto",
      "sourceAssets": 1,
      "concreteCases": null,
      "expansion": "UNEXPANDED",
      "implementation": "UNIMPLEMENTED",
      "compiler": "NOT_RUN",
      "reference": "NOT_RUN",
      "acceptance": "NOT_RUN",
      "evidence": []
    },
    {
      "id": "go:tsc/cmd/tsc",
      "sourceAssets": 1,
      "concreteCases": null,
      "expansion": "UNEXPANDED",
      "implementation": "UNIMPLEMENTED",
      "compiler": "NOT_RUN",
      "reference": "NOT_RUN",
      "acceptance": "NOT_RUN",
      "evidence": []
    },
    {
      "id": "go:tsc/internal/api",
      "sourceAssets": 15,
      "concreteCases": null,
      "expansion": "UNEXPANDED",
      "implementation": "UNIMPLEMENTED",
      "compiler": "NOT_RUN",
      "reference": "NOT_RUN",
      "acceptance": "NOT_RUN",
      "evidence": []
    },
    {
      "id": "go:tsc/internal/api/encoder",
      "sourceAssets": 3,
      "concreteCases": null,
      "expansion": "UNEXPANDED",
      "implementation": "UNIMPLEMENTED",
      "compiler": "NOT_RUN",
      "reference": "NOT_RUN",
      "acceptance": "NOT_RUN",
      "evidence": []
    },
    {
      "id": "go:tsc/internal/api/requestfilesystem",
      "sourceAssets": 3,
      "concreteCases": null,
      "expansion": "UNEXPANDED",
      "implementation": "UNIMPLEMENTED",
      "compiler": "NOT_RUN",
      "reference": "NOT_RUN",
      "acceptance": "NOT_RUN",
      "evidence": []
    },
    {
      "id": "go:tsc/internal/ast",
      "sourceAssets": 7,
      "concreteCases": null,
      "expansion": "UNEXPANDED",
      "implementation": "UNIMPLEMENTED",
      "compiler": "NOT_RUN",
      "reference": "NOT_RUN",
      "acceptance": "NOT_RUN",
      "evidence": []
    },
    {
      "id": "go:tsc/internal/astnav",
      "sourceAssets": 2,
      "concreteCases": null,
      "expansion": "UNEXPANDED",
      "implementation": "UNIMPLEMENTED",
      "compiler": "NOT_RUN",
      "reference": "NOT_RUN",
      "acceptance": "NOT_RUN",
      "evidence": []
    },
    {
      "id": "go:tsc/internal/binder",
      "sourceAssets": 1,
      "concreteCases": null,
      "expansion": "UNEXPANDED",
      "implementation": "UNIMPLEMENTED",
      "compiler": "NOT_RUN",
      "reference": "NOT_RUN",
      "acceptance": "NOT_RUN",
      "evidence": []
    },
    {
      "id": "go:tsc/internal/bundled",
      "sourceAssets": 1,
      "concreteCases": null,
      "expansion": "UNEXPANDED",
      "implementation": "UNIMPLEMENTED",
      "compiler": "NOT_RUN",
      "reference": "NOT_RUN",
      "acceptance": "NOT_RUN",
      "evidence": []
    },
    {
      "id": "go:tsc/internal/checker",
      "sourceAssets": 3,
      "concreteCases": null,
      "expansion": "UNEXPANDED",
      "implementation": "UNIMPLEMENTED",
      "compiler": "NOT_RUN",
      "reference": "NOT_RUN",
      "acceptance": "NOT_RUN",
      "evidence": []
    },
    {
      "id": "go:tsc/internal/collections",
      "sourceAssets": 3,
      "concreteCases": null,
      "expansion": "UNEXPANDED",
      "implementation": "UNIMPLEMENTED",
      "compiler": "NOT_RUN",
      "reference": "NOT_RUN",
      "acceptance": "NOT_RUN",
      "evidence": []
    },
    {
      "id": "go:tsc/internal/compiler",
      "sourceAssets": 5,
      "concreteCases": null,
      "expansion": "UNEXPANDED",
      "implementation": "UNIMPLEMENTED",
      "compiler": "NOT_RUN",
      "reference": "NOT_RUN",
      "acceptance": "NOT_RUN",
      "evidence": []
    },
    {
      "id": "go:tsc/internal/contentmapper",
      "sourceAssets": 2,
      "concreteCases": null,
      "expansion": "UNEXPANDED",